{
  "$schema": "https://json-schema.org/draft/2020-12/schema",
  "$id": "https://schemas.0xhoneyjar.com/loa-hounfour/8.8.0/deliberation-dissent",
  "additionalProperties": false,
  "description": "Mid-deliberation concern, minority verdict, or process objection. Distinct lifecycle from governance DissentRecord.",
  "type": "object",
  "required": [
    "dissent_id",
    "artifact_id",
    "juror",
    "concern_type",
    "narrative",
    "cited_claim_ids",
    "raised_at",
    "contract_version"
  ],
  "properties": {
    "dissent_id": {
      "pattern": "^[0-9A-HJKMNP-TV-Z]{26}$",
      "description": "ULID (Crockford Base32, 26 chars). Aligns with verdict_id / report_id ULID convention.",
      "type": "string"
    },
    "artifact_id": {
      "minLength": 1,
      "description": "FK to PanelDecisionArtifact.artifact_id (cross-record existence is consumer-enforced per NF-1).",
      "type": "string"
    },
    "juror": {
      "additionalProperties": false,
      "x-cross-field-validated": true,
      "description": "Canonical agent identity with capability-scoped trust (v6.0.0, BREAKING).",
      "type": "object",
      "required": [
        "agent_id",
        "display_name",
        "agent_type",
        "capabilities",
        "trust_scopes",
        "delegation_authority",
        "max_delegation_depth",
        "governance_weight",
        "contract_version"
      ],
      "properties": {
        "agent_id": {
          "pattern": "^[a-z][a-z0-9_-]{2,63}$",
          "description": "Unique agent identifier (lowercase, 3-64 chars).",
          "type": "string"
        },
        "display_name": {
          "minLength": 1,
          "maxLength": 128,
          "description": "Human-readable agent display name.",
          "type": "string"
        },
        "agent_type": {
          "description": "Classification of agent type in the protocol.",
          "anyOf": [
            {
              "const": "model",
              "type": "string"
            },
            {
              "const": "orchestrator",
              "type": "string"
            },
            {
              "const": "human",
              "type": "string"
            },
            {
              "const": "service",
              "type": "string"
            },
            {
              "const": "composite",
              "type": "string"
            }
          ]
        },
        "capabilities": {
          "minItems": 1,
          "description": "Non-empty list of agent capabilities.",
          "type": "array",
          "items": {
            "minLength": 1,
            "type": "string"
          }
        },
        "trust_scopes": {
          "additionalProperties": false,
          "description": "Per-capability-scope trust levels with default fallback (v6.0.0; v8.5.0 EXTEND adds optional match_strategy + precedence_score per D-007 / OQ-S6).",
          "type": "object",
          "required": [
            "scopes",
            "default_level"
          ],
          "properties": {
            "scopes": {
              "additionalProperties": false,
              "description": "Per-scope trust levels. Missing scopes fall back to default_level.",
              "type": "object",
              "properties": {
                "billing": {
                  "description": "Trust level assigned to an agent. Forms a total order from untrusted to sovereign.",
                  "anyOf": [
                    {
                      "const": "untrusted",
                      "type": "string"
                    },
                    {
                      "const": "basic",
                      "type": "string"
                    },
                    {
                      "const": "verified",
                      "type": "string"
                    },
                    {
                      "const": "trusted",
                      "type": "string"
                    },
                    {
                      "const": "sovereign",
                      "type": "string"
                    }
                  ]
                },
                "governance": {
                  "description": "Trust level assigned to an agent. Forms a total order from untrusted to sovereign.",
                  "anyOf": [
                    {
                      "const": "untrusted",
                      "type": "string"
                    },
                    {
                      "const": "basic",
                      "type": "string"
                    },
                    {
                      "const": "verified",
                      "type": "string"
                    },
                    {
                      "const": "trusted",
                      "type": "string"
                    },
                    {
                      "const": "sovereign",
                      "type": "string"
                    }
                  ]
                },
                "inference": {
                  "description": "Trust level assigned to an agent. Forms a total order from untrusted to sovereign.",
                  "anyOf": [
                    {
                      "const": "untrusted",
                      "type": "string"
                    },
                    {
                      "const": "basic",
                      "type": "string"
                    },
                    {
                      "const": "verified",
                      "type": "string"
                    },
                    {
                      "const": "trusted",
                      "type": "string"
                    },
                    {
                      "const": "sovereign",
                      "type": "string"
                    }
                  ]
                },
                "delegation": {
                  "description": "Trust level assigned to an agent. Forms a total order from untrusted to sovereign.",
                  "anyOf": [
                    {
                      "const": "untrusted",
                      "type": "string"
                    },
                    {
                      "const": "basic",
                      "type": "string"
                    },
                    {
                      "const": "verified",
                      "type": "string"
                    },
                    {
                      "const": "trusted",
                      "type": "string"
                    },
                    {
                      "const": "sovereign",
                      "type": "string"
                    }
                  ]
                },
                "audit": {
                  "description": "Trust level assigned to an agent. Forms a total order from untrusted to sovereign.",
                  "anyOf": [
                    {
                      "const": "untrusted",
                      "type": "string"
                    },
                    {
                      "const": "basic",
                      "type": "string"
                    },
                    {
                      "const": "verified",
                      "type": "string"
                    },
                    {
                      "const": "trusted",
                      "type": "string"
                    },
                    {
                      "const": "sovereign",
                      "type": "string"
                    }
                  ]
                },
                "composition": {
                  "description": "Trust level assigned to an agent. Forms a total order from untrusted to sovereign.",
                  "anyOf": [
                    {
                      "const": "untrusted",
                      "type": "string"
                    },
                    {
                      "const": "basic",
                      "type": "string"
                    },
                    {
                      "const": "verified",
                      "type": "string"
                    },
                    {
                      "const": "trusted",
                      "type": "string"
                    },
                    {
                      "const": "sovereign",
                      "type": "string"
                    }
                  ]
                }
              }
            },
            "default_level": {
              "description": "Trust level assigned to an agent. Forms a total order from untrusted to sovereign.",
              "anyOf": [
                {
                  "const": "untrusted",
                  "type": "string"
                },
                {
                  "const": "basic",
                  "type": "string"
                },
                {
                  "const": "verified",
                  "type": "string"
                },
                {
                  "const": "trusted",
                  "type": "string"
                },
                {
                  "const": "sovereign",
                  "type": "string"
                }
              ]
            },
            "match_strategy": {
              "description": "How a SignerCompetenceRule.required_capability_scopes set is compared against this profile's scopes. Default behavior on absence is \"subset\" (the trust profile must include every required scope) — preserves v8.4.0 implicit semantics.",
              "anyOf": [
                {
                  "const": "exact",
                  "type": "string"
                },
                {
                  "const": "subset",
                  "type": "string"
                },
                {
                  "const": "superset",
                  "type": "string"
                }
              ]
            },
            "precedence_score": {
              "minimum": 0,
              "maximum": 1000,
              "description": "Tiebreaker when multiple SignerCompetenceRules match the same action. Higher score wins. Absence means \"no preference\" — consumers fall back to rule-list order.",
              "type": "integer"
            }
          }
        },
        "delegation_authority": {
          "description": "Permissions this agent may delegate. Requires delegation scope >= verified.",
          "type": "array",
          "items": {
            "minLength": 1,
            "type": "string"
          }
        },
        "max_delegation_depth": {
          "minimum": 0,
          "maximum": 10,
          "description": "Maximum delegation chain depth this agent may create.",
          "type": "integer"
        },
        "governance_weight": {
          "minimum": 0,
          "maximum": 1,
          "description": "Voting weight in governance proposals (0-1).",
          "type": "number"
        },
        "metadata": {
          "description": "Extensible metadata key-value store.",
          "type": "object",
          "patternProperties": {
            "^(.*)$": {}
          }
        },
        "contract_version": {
          "pattern": "^\\d+\\.\\d+\\.\\d+$",
          "description": "Protocol contract version.",
          "type": "string"
        }
      }
    },
    "concern_type": {
      "description": "Frozen union; invalid-vector mutation tests rely on this set being closed.",
      "anyOf": [
        {
          "const": "minority_verdict",
          "type": "string"
        },
        {
          "const": "process_objection",
          "type": "string"
        },
        {
          "const": "mid_deliberation_concern",
          "type": "string"
        }
      ]
    },
    "narrative": {
      "minLength": 1,
      "maxLength": 16384,
      "description": "Free-text rationale; max length matches DelegationVoteSchema.reasoning convention.",
      "type": "string"
    },
    "cited_claim_ids": {
      "minItems": 0,
      "description": "Optional grounding citations to PanelDecisionArtifact.claims[].claim_id. Cross-record existence is NOT enforced (consumer-side per NF-1 / R6).",
      "type": "array",
      "items": {
        "minLength": 1,
        "type": "string"
      }
    },
    "raised_at": {
      "format": "date-time",
      "description": "ISO 8601 timestamp at which the dissent was raised.",
      "type": "string"
    },
    "contract_version": {
      "pattern": "^[1-9][0-9]*\\.(0|[1-9][0-9]*)\\.(0|[1-9][0-9]*)$",
      "description": "Semver 2.0.0-formatted protocol contract version pinned at dissent time. Major version must be >= 1; leading zeros are rejected on every component.",
      "type": "string"
    }
  },
  "$comment": "contract_version=8.8.0, min_supported=6.0.0"
}
